{
  "format": "jellyframe.app",
  "formatVersion": 0,
  "id": "org.jellyframe.tests.ws147-touch-drag-latency",
  "name": "WS147 Touch Drag Latency",
  "version": {"name": "1.0.0", "code": 1},
  "entry": "/index.html",
  "runtime": {"minJellyFrame": "0.6.0", "minRenderCore": "0.6.2", "script": "none"},
  "viewport": {"designWidth": 172, "designHeight": 320, "shape": "rect"},
  "budgets": {
    "maxResourceBytes": 12288,
    "maxDomNodes": 48,
    "maxCssRules": 24,
    "maxDisplayCommands": 96
  },
  "capabilities": [],
  "targets": {
    "rect-172x320": {
      "viewport": {"width": 172, "height": 320, "shape": "rect"},
      "output": "jfapp"
    }
  }
}
