{
  "$schema": "https://raw.githubusercontent.com/xiaopaoya/JellyFrame/master/tools/schemas/jellyframe.app.schema.json",
  "format": "jellyframe.app",
  "formatVersion": 0,
  "id": "org.jellyframe.template.blank",
  "name": "Blank App",
  "version": {
    "name": "0.1.0",
    "code": 1
  },
  "entry": "/index.html",
  "runtime": {
    "minJellyFrame": "0.6.0",
    "minRenderCore": "0.6.2",
    "script": "classic"
  },
  "viewport": {
    "designWidth": 300,
    "designHeight": 300,
    "shape": "round"
  },
  "budgets": {
    "maxResourceBytes": 16384
  },
  "targets": {
    "round-300": {
      "viewport": {
        "width": 300,
        "height": 300,
        "shape": "round"
      },
      "output": "cpp"
    }
  }
}
