{
  "$schema": "../../../../tools/schemas/jellyframe.app.schema.json",
  "format": "jellyframe.app",
  "formatVersion": 0,
  "id": "org.jellyframe.examples.jelly_controls",
  "name": "Jelly Controls",
  "version": {
    "name": "0.1.0",
    "code": 1
  },
  "entry": "/index.html",
  "runtime": {
    "minJellyFrame": "0.6.0",
    "minRenderCore": "0.6.2",
    "script": "classic"
  },
  "viewport": {
    "designWidth": 300,
    "designHeight": 300,
    "shape": "round"
  },
  "budgets": {
    "maxResourceBytes": 65536,
    "maxDomNodes": 256,
    "maxCssRules": 160,
    "maxDisplayCommands": 384,
    "maxTimers": 2,
    "maxEventListeners": 16
  },
  "capabilities": [],
  "targets": {
    "round-300": {
      "viewport": {
        "width": 300,
        "height": 300,
        "shape": "round"
      },
      "fontProfile": "tiny-plus-symbols",
      "output": "jfapp",
      "gate": {
        "policy": "reject",
        "minViewport": {
          "width": 300,
          "height": 300
        },
        "allowScroll": false,
        "allowHorizontalOverflow": false,
        "maxWarnings": 0,
        "maxErrors": 0
      }
    },
    "rect-320x240": {
      "viewport": {
        "width": 320,
        "height": 240,
        "shape": "rect"
      },
      "fontProfile": "tiny-plus-symbols",
      "output": "jfapp",
      "gate": {
        "policy": "reject",
        "minViewport": {
          "width": 320,
          "height": 240
        },
        "allowScroll": false,
        "allowHorizontalOverflow": false,
        "maxWarnings": 0,
        "maxErrors": 0
      }
    },
    "rect-172x320": {
      "viewport": {
        "width": 172,
        "height": 320,
        "shape": "rect"
      },
      "fontProfile": "tiny-plus-symbols",
      "output": "jfapp",
      "gate": {
        "policy": "reject",
        "minViewport": {
          "width": 172,
          "height": 320
        },
        "allowScroll": false,
        "allowHorizontalOverflow": false,
        "maxWarnings": 0,
        "maxErrors": 0
      }
    }
  },
  "requiresFeatures": [
    "css.flex-grid",
    "css.modern-paint"
  ]
}
