{
  "$schema": "../../../../tools/schemas/jellyframe.app.schema.json",
  "format": "jellyframe.app",
  "formatVersion": 0,
  "id": "org.jellyframe.examples.audio_smoke",
  "name": "Audio Smoke",
  "version": {
    "name": "0.1.0",
    "code": 1
  },
  "entry": "/index.html",
  "runtime": {
    "minJellyFrame": "0.6.0",
    "minRenderCore": "0.6.1",
    "script": "classic"
  },
  "viewport": {
    "designWidth": 300,
    "designHeight": 300,
    "shape": "round"
  },
  "budgets": {
    "maxResourceBytes": 65536,
    "maxDomNodes": 120,
    "maxCssRules": 80,
    "maxDisplayCommands": 180
  },
  "capabilities": ["media.audio.playback"],
  "targets": {
    "round-300": {
      "viewport": {
        "width": 300,
        "height": 300,
        "shape": "round"
      },
      "fontProfile": "tiny-plus-symbols",
      "output": "jfapp"
    }
  }
}
