{
  "format": "jellyframe.app",
  "formatVersion": 0,
  "id": "org.jellyframe.fixture.installed-script-input",
  "name": "Installed Script Input Fixture",
  "version": {"name": "1.0.0", "code": 1},
  "entry": "/index.html",
  "runtime": {"minJellyFrame": "0.6.0", "minRenderCore": "0.6.1", "script": "classic"},
  "viewport": {"designWidth": 172, "designHeight": 320, "shape": "rect"},
  "budgets": {
    "maxResourceBytes": 8192,
    "maxDomNodes": 32,
    "maxCssRules": 16,
    "maxDisplayCommands": 64,
    "maxTimers": 1,
    "maxEventListeners": 4
  },
  "capabilities": [],
  "targets": {
    "rect-172x320": {
      "viewport": {"width": 172, "height": 320, "shape": "rect"},
      "fontProfile": "tiny-plus-symbols",
      "output": "jfapp"
    }
  }
}
